{
  "schema_version": "0.1",
  "research_date": "2026-10-05",
  "live_operations_enabled": 0,
  "admission_policy": "DENY_BY_DEFAULT",
  "tools": [
    {
      "id": "T01",
      "semantic_mcp_tool": "list_capabilities",
      "capability_group": "DISCOVERY",
      "kind": "LOCAL",
      "service": "NOVA",
      "domain": "local",
      "api_version": null,
      "deployment": null,
      "verified_release": null,
      "classification": "UNKNOWN",
      "classification_scope": "LOCAL_NOT_APPLICABLE",
      "implementation_status": "LOCAL_SPEC_READY",
      "enabled_by_default": false,
      "operation": {
        "operation_id": null,
        "http_method": null,
        "path": null
      },
      "official_documentation_sources": [],
      "evidence_strength": "NOVA_ORIGINAL_SPECIFICATION",
      "authentication": {
        "profile": null,
        "mechanism": null,
        "verified": false
      },
      "csrf_requirement": "NOT_APPLICABLE",
      "required_role": null,
      "required_license": null,
      "security_context_requirement": null,
      "upstream_input_schema": null,
      "upstream_output_schema": null,
      "proposed_semantic_input_schema_ref": "../contracts/semantic-tool.schema.json#/$defs/discovery",
      "proposed_semantic_output_schema_ref": "../contracts/semantic-tool.schema.json#/$defs/result_envelope",
      "read_write_classification": "LOCAL_READ",
      "risk_level": "L0",
      "risk_level_provisional": false,
      "idempotency": "LOCAL_PURE_READ",
      "approval_requirement": "NONE",
      "verified_contract": false,
      "runtime_verified": false,
      "publication_reviewed": false,
      "admission_blockers": [],
      "observed_operation_leads": [],
      "notes": "Read the versioned local registry; do not probe the tenant."
    },
    {
      "id": "T02",
      "semantic_mcp_tool": "get_runtime_status",
      "capability_group": "DISCOVERY",
      "kind": "LOCAL",
      "service": "NOVA",
      "domain": "local",
      "api_version": null,
      "deployment": null,
      "verified_release": null,
      "classification": "UNKNOWN",
      "classification_scope": "LOCAL_NOT_APPLICABLE",
      "implementation_status": "LOCAL_SPEC_READY",
      "enabled_by_default": false,
      "operation": {
        "operation_id": null,
        "http_method": null,
        "path": null
      },
      "official_documentation_sources": [],
      "evidence_strength": "NOVA_ORIGINAL_SPECIFICATION",
      "authentication": {
        "profile": null,
        "mechanism": null,
        "verified": false
      },
      "csrf_requirement": "NOT_APPLICABLE",
      "required_role": null,
      "required_license": null,
      "security_context_requirement": null,
      "upstream_input_schema": null,
      "upstream_output_schema": null,
      "proposed_semantic_input_schema_ref": "../contracts/semantic-tool.schema.json#/$defs/discovery",
      "proposed_semantic_output_schema_ref": "../contracts/semantic-tool.schema.json#/$defs/result_envelope",
      "read_write_classification": "LOCAL_READ",
      "risk_level": "L0",
      "risk_level_provisional": false,
      "idempotency": "LOCAL_PURE_READ",
      "approval_requirement": "NONE",
      "verified_contract": false,
      "runtime_verified": false,
      "publication_reviewed": false,
      "admission_blockers": [],
      "observed_operation_leads": [],
      "notes": "Expose readiness booleans only; no hosts, identities, keys or credential paths."
    },
    {
      "id": "T03",
      "semantic_mcp_tool": "get_current_user",
      "capability_group": "IDENTITY",
      "kind": "PLATFORM",
      "service": "3DPassport",
      "domain": "identity",
      "api_version": null,
      "deployment": null,
      "verified_release": null,
      "classification": "UNKNOWN",
      "classification_scope": "PROPOSED_UPSTREAM_OPERATION",
      "implementation_status": "BLOCKED_PENDING_VERIFICATION",
      "enabled_by_default": false,
      "operation": {
        "operation_id": null,
        "http_method": null,
        "path": null
      },
      "official_documentation_sources": [
        "S01",
        "S06"
      ],
      "evidence_strength": "NO_OPERATION_CONTRACT",
      "authentication": {
        "profile": null,
        "mechanism": null,
        "verified": false
      },
      "csrf_requirement": "UNKNOWN",
      "required_role": null,
      "required_license": null,
      "security_context_requirement": null,
      "upstream_input_schema": null,
      "upstream_output_schema": null,
      "proposed_semantic_input_schema_ref": "../contracts/semantic-tool.schema.json#/$defs/discovery",
      "proposed_semantic_output_schema_ref": "../contracts/semantic-tool.schema.json#/$defs/result_envelope",
      "read_write_classification": "READ_INTENT_UNVERIFIED",
      "risk_level": "L1",
      "risk_level_provisional": true,
      "idempotency": "UNKNOWN",
      "approval_requirement": "AUTHORIZED_READ_SCOPE",
      "verified_contract": false,
      "runtime_verified": false,
      "publication_reviewed": false,
      "admission_blockers": [
        "PUBLIC_OPERATION_CONTRACT_UNVERIFIED",
        "RELEASE_AND_DEPLOYMENT_UNVERIFIED",
        "AUTH_PROFILE_UNVERIFIED",
        "SCHEMAS_UNVERIFIED",
        "ENTITLEMENT_UNVERIFIED",
        "RUNTIME_UNTESTED"
      ],
      "observed_operation_leads": [],
      "notes": "Verify a current-user public contract; return a pseudonym, never credentials."
    },
    {
      "id": "T04",
      "semantic_mcp_tool": "list_security_contexts",
      "capability_group": "IDENTITY",
      "kind": "PLATFORM",
      "service": "3DSpace",
      "domain": "authorization",
      "api_version": null,
      "deployment": null,
      "verified_release": null,
      "classification": "UNKNOWN",
      "classification_scope": "PROPOSED_UPSTREAM_OPERATION",
      "implementation_status": "BLOCKED_PENDING_VERIFICATION",
      "enabled_by_default": false,
      "operation": {
        "operation_id": null,
        "http_method": null,
        "path": null
      },
      "official_documentation_sources": [
        "S01"
      ],
      "evidence_strength": "NO_OPERATION_CONTRACT",
      "authentication": {
        "profile": null,
        "mechanism": null,
        "verified": false
      },
      "csrf_requirement": "UNKNOWN",
      "required_role": null,
      "required_license": null,
      "security_context_requirement": null,
      "upstream_input_schema": null,
      "upstream_output_schema": null,
      "proposed_semantic_input_schema_ref": "../contracts/semantic-tool.schema.json#/$defs/discovery",
      "proposed_semantic_output_schema_ref": "../contracts/semantic-tool.schema.json#/$defs/result_envelope",
      "read_write_classification": "READ_INTENT_UNVERIFIED",
      "risk_level": "L1",
      "risk_level_provisional": true,
      "idempotency": "UNKNOWN",
      "approval_requirement": "AUTHORIZED_READ_SCOPE",
      "verified_contract": false,
      "runtime_verified": false,
      "publication_reviewed": false,
      "admission_blockers": [
        "PUBLIC_OPERATION_CONTRACT_UNVERIFIED",
        "RELEASE_AND_DEPLOYMENT_UNVERIFIED",
        "AUTH_PROFILE_UNVERIFIED",
        "SCHEMAS_UNVERIFIED",
        "ENTITLEMENT_UNVERIFIED",
        "RUNTIME_UNTESTED"
      ],
      "observed_operation_leads": [],
      "notes": "Verify context enumeration and current-principal scope."
    },
    {
      "id": "T05",
      "semantic_mcp_tool": "search_engineering_items",
      "capability_group": "SEARCH",
      "kind": "PLATFORM",
      "service": "3DSpace",
      "domain": "engineering",
      "api_version": null,
      "deployment": null,
      "verified_release": null,
      "classification": "PUBLIC_UNCLEAR",
      "classification_scope": "PROPOSED_UPSTREAM_OPERATION",
      "implementation_status": "BLOCKED_PENDING_VERIFICATION",
      "enabled_by_default": false,
      "operation": {
        "operation_id": null,
        "http_method": null,
        "path": null
      },
      "official_documentation_sources": [
        "S04"
      ],
      "evidence_strength": "PUBLIC_FAMILY_OR_EXAMPLE_ONLY",
      "authentication": {
        "profile": null,
        "mechanism": null,
        "verified": false
      },
      "csrf_requirement": "UNKNOWN",
      "required_role": null,
      "required_license": null,
      "security_context_requirement": null,
      "upstream_input_schema": null,
      "upstream_output_schema": null,
      "proposed_semantic_input_schema_ref": "../contracts/semantic-tool.schema.json#/$defs/search",
      "proposed_semantic_output_schema_ref": "../contracts/semantic-tool.schema.json#/$defs/result_envelope",
      "read_write_classification": "READ_INTENT_UNVERIFIED",
      "risk_level": "L1",
      "risk_level_provisional": true,
      "idempotency": "UNKNOWN",
      "approval_requirement": "AUTHORIZED_READ_SCOPE",
      "verified_contract": false,
      "runtime_verified": false,
      "publication_reviewed": false,
      "admission_blockers": [
        "PUBLIC_OPERATION_CONTRACT_UNVERIFIED",
        "RELEASE_AND_DEPLOYMENT_UNVERIFIED",
        "AUTH_PROFILE_UNVERIFIED",
        "SCHEMAS_UNVERIFIED",
        "ENTITLEMENT_UNVERIFIED",
        "RUNTIME_UNTESTED"
      ],
      "observed_operation_leads": [],
      "notes": "Search is described in a historical example; current path, filters and pagination unverified."
    },
    {
      "id": "T06",
      "semantic_mcp_tool": "get_engineering_item",
      "capability_group": "ENGINEERING_OBJECTS",
      "kind": "PLATFORM",
      "service": "3DSpace",
      "domain": "engineering",
      "api_version": null,
      "deployment": null,
      "verified_release": null,
      "classification": "PUBLIC_UNCLEAR",
      "classification_scope": "PROPOSED_UPSTREAM_OPERATION",
      "implementation_status": "BLOCKED_PENDING_VERIFICATION",
      "enabled_by_default": false,
      "operation": {
        "operation_id": null,
        "http_method": null,
        "path": null
      },